{
  "$schema": "https://json-schema.org/draft/2020-12/schema",
  "title": "Paper readiness record",
  "type": "object",
  "properties": {
    "schema_version": {
      "const": "1.0"
    },
    "paper": {
      "type": "string",
      "minLength": 1
    },
    "version": {
      "type": "string",
      "minLength": 1
    },
    "recorded_utc": {
      "type": "string",
      "minLength": 1
    },
    "snapshot_state": {
      "type": "string",
      "minLength": 1
    },
    "pdf_sha256": {
      "type": "string",
      "pattern": "^[0-9a-f]{64}$"
    },
    "source_locations": {
      "type": "array",
      "items": {
        "type": "string",
        "minLength": 1
      }
    },
    "claims": {
      "type": "array",
      "minItems": 1,
      "items": {
        "type": "object",
        "properties": {
          "id": {
            "type": "string",
            "minLength": 1
          },
          "statement": {
            "type": "string",
            "minLength": 1
          },
          "hypotheses": {
            "type": "array",
            "items": {
              "type": "string",
              "minLength": 1
            }
          },
          "quantifiers": {
            "type": "string",
            "minLength": 1
          },
          "dependencies": {
            "type": "array",
            "items": {
              "type": "string",
              "minLength": 1
            }
          },
          "evidence_kind": {
            "enum": [
              "Observed",
              "finiteVerified",
              "analyticProved",
              "computerAssistedProved",
              "PublishedEstablished"
            ]
          },
          "verification_state": {
            "enum": [
              "unreviewed",
              "audited",
              "disputed",
              "blocked"
            ]
          },
          "novelty_status": {
            "enum": [
              "not_assessed",
              "inherited",
              "bounded_search_no_match",
              "overlap_unresolved",
              "new_contribution_proposed"
            ]
          },
          "scope_exclusions": {
            "type": "array",
            "items": {
              "type": "string",
              "minLength": 1
            }
          },
          "formal_coverage": {
            "enum": [
              "unformalized",
              "partial",
              "formalized"
            ]
          },
          "finite_domain": {
            "type": "string",
            "minLength": 1
          },
          "primary_publication": {
            "type": "string",
            "minLength": 1
          },
          "publication_status": {
            "enum": [
              "published",
              "preprint",
              "unpublished",
              "not_applicable"
            ]
          },
          "evidence": {
            "type": "array",
            "minItems": 1,
            "items": {
              "type": "object",
              "properties": {
                "path": {
                  "type": "string",
                  "minLength": 1
                },
                "sha256": {
                  "type": "string",
                  "pattern": "^[0-9a-f]{64}$"
                },
                "locator": {
                  "type": "string",
                  "minLength": 1
                }
              },
              "required": [
                "path",
                "sha256"
              ],
              "additionalProperties": false
            }
          }
        },
        "required": [
          "id",
          "statement",
          "hypotheses",
          "quantifiers",
          "dependencies",
          "evidence_kind",
          "verification_state",
          "novelty_status",
          "scope_exclusions",
          "formal_coverage",
          "evidence"
        ],
        "additionalProperties": false,
        "allOf": [
          {
            "if": {
              "properties": {
                "evidence_kind": {
                  "enum": [
                    "finiteVerified",
                    "computerAssistedProved"
                  ]
                }
              }
            },
            "then": {
              "required": [
                "finite_domain"
              ]
            }
          },
          {
            "if": {
              "properties": {
                "evidence_kind": {
                  "const": "PublishedEstablished"
                }
              }
            },
            "then": {
              "required": [
                "primary_publication"
              ]
            }
          }
        ]
      }
    },
    "gates": {
      "type": "array",
      "minItems": 16,
      "maxItems": 16,
      "items": {
        "type": "object",
        "properties": {
          "id": {
            "enum": [
              "S00",
              "S01",
              "S02",
              "S03",
              "S04",
              "S05",
              "S06",
              "S07",
              "S08",
              "S09",
              "S10",
              "S11",
              "S12",
              "S13",
              "S14",
              "S15"
            ]
          },
          "status": {
            "enum": [
              "pass",
              "pending",
              "blocked",
              "not_applicable"
            ]
          },
          "owner": {
            "type": "string",
            "minLength": 1
          },
          "version": {
            "type": "string",
            "minLength": 1
          },
          "acceptance": {
            "type": "string",
            "minLength": 1
          },
          "notes": {
            "type": "string",
            "minLength": 1
          },
          "evidence": {
            "type": "array",
            "items": {
              "type": "object",
              "properties": {
                "path": {
                  "type": "string",
                  "minLength": 1
                },
                "sha256": {
                  "type": "string",
                  "pattern": "^[0-9a-f]{64}$"
                },
                "locator": {
                  "type": "string",
                  "minLength": 1
                }
              },
              "required": [
                "path",
                "sha256"
              ],
              "additionalProperties": false
            }
          },
          "review_context_id": {
            "type": "string",
            "minLength": 1
          },
          "justification": {
            "type": "string",
            "minLength": 1
          },
          "approved_by": {
            "type": "string",
            "minLength": 1
          }
        },
        "required": [
          "id",
          "status",
          "owner",
          "notes"
        ],
        "additionalProperties": false
      }
    },
    "review_contexts": {
      "type": "array",
      "items": {
        "type": "object",
        "properties": {
          "context_id": {
            "type": "string",
            "minLength": 1
          },
          "reviewer_id": {
            "type": "string",
            "minLength": 1
          },
          "editor_id": {
            "type": "string",
            "minLength": 1
          },
          "rounds_used": {
            "type": "integer",
            "minimum": 1,
            "maximum": 2
          },
          "retired": {
            "type": "boolean"
          },
          "initial_inherited_history": {
            "const": false
          },
          "exposure": {
            "enum": [
              "clean",
              "contaminated_disclosed"
            ]
          },
          "reviewed_version": {
            "type": "string",
            "minLength": 1
          },
          "replacement_context_id": {
            "type": "string",
            "minLength": 1
          },
          "exposure_evidence": {
            "type": "array",
            "items": {
              "type": "object",
              "properties": {
                "path": {
                  "type": "string",
                  "minLength": 1
                },
                "sha256": {
                  "type": "string",
                  "pattern": "^[0-9a-f]{64}$"
                },
                "locator": {
                  "type": "string",
                  "minLength": 1
                }
              },
              "required": [
                "path",
                "sha256"
              ],
              "additionalProperties": false
            }
          }
        },
        "required": [
          "context_id",
          "reviewer_id",
          "editor_id",
          "rounds_used",
          "retired",
          "initial_inherited_history",
          "exposure",
          "reviewed_version"
        ],
        "additionalProperties": false
      }
    },
    "blockers": {
      "type": "array",
      "items": {
        "type": "string",
        "minLength": 1
      }
    },
    "submission": {
      "type": "object",
      "properties": {
        "authors_confirmed": {
          "type": "boolean"
        },
        "journal_selected": {
          "type": "boolean"
        },
        "consent_confirmed": {
          "type": "boolean"
        },
        "disclosures_checked": {
          "type": "boolean"
        },
        "automatic_submission": {
          "const": false
        },
        "publication_authorized": {
          "type": "boolean"
        },
        "notes": {
          "type": "string",
          "minLength": 1
        }
      },
      "required": [
        "authors_confirmed",
        "journal_selected",
        "consent_confirmed",
        "disclosures_checked",
        "automatic_submission",
        "publication_authorized",
        "notes"
      ],
      "additionalProperties": false
    },
    "input_pdf": {
      "type": "object",
      "properties": {
        "path": {
          "type": "string",
          "minLength": 1
        },
        "sha256": {
          "type": "string",
          "pattern": "^[0-9a-f]{64}$"
        },
        "locator": {
          "type": "string",
          "minLength": 1
        }
      },
      "required": [
        "path",
        "sha256"
      ],
      "additionalProperties": false
    },
    "input_sources": {
      "type": "array",
      "minItems": 1,
      "items": {
        "type": "object",
        "properties": {
          "path": {
            "type": "string",
            "minLength": 1
          },
          "sha256": {
            "type": "string",
            "pattern": "^[0-9a-f]{64}$"
          },
          "locator": {
            "type": "string",
            "minLength": 1
          }
        },
        "required": [
          "path",
          "sha256"
        ],
        "additionalProperties": false
      }
    },
    "linked_records": {
      "type": "object",
      "properties": {
        "proof_obligations": {
          "type": "object",
          "properties": {
            "path": {
              "type": "string",
              "minLength": 1
            },
            "sha256": {
              "type": "string",
              "pattern": "^[0-9a-f]{64}$"
            },
            "locator": {
              "type": "string",
              "minLength": 1
            }
          },
          "required": [
            "path",
            "sha256"
          ],
          "additionalProperties": false
        },
        "review_response": {
          "type": "object",
          "properties": {
            "path": {
              "type": "string",
              "minLength": 1
            },
            "sha256": {
              "type": "string",
              "pattern": "^[0-9a-f]{64}$"
            },
            "locator": {
              "type": "string",
              "minLength": 1
            }
          },
          "required": [
            "path",
            "sha256"
          ],
          "additionalProperties": false
        },
        "version_registry": {
          "type": "object",
          "properties": {
            "path": {
              "type": "string",
              "minLength": 1
            },
            "sha256": {
              "type": "string",
              "pattern": "^[0-9a-f]{64}$"
            },
            "locator": {
              "type": "string",
              "minLength": 1
            }
          },
          "required": [
            "path",
            "sha256"
          ],
          "additionalProperties": false
        },
        "receipts": {
          "type": "object",
          "properties": {
            "path": {
              "type": "string",
              "minLength": 1
            },
            "sha256": {
              "type": "string",
              "pattern": "^[0-9a-f]{64}$"
            },
            "locator": {
              "type": "string",
              "minLength": 1
            }
          },
          "required": [
            "path",
            "sha256"
          ],
          "additionalProperties": false
        },
        "required_inventory": {
          "type": "object",
          "properties": {
            "path": {
              "type": "string",
              "minLength": 1
            },
            "sha256": {
              "type": "string",
              "pattern": "^[0-9a-f]{64}$"
            },
            "locator": {
              "type": "string",
              "minLength": 1
            }
          },
          "required": [
            "path",
            "sha256"
          ],
          "additionalProperties": false
        }
      },
      "required": [
        "proof_obligations",
        "review_response",
        "version_registry",
        "receipts",
        "required_inventory"
      ],
      "additionalProperties": false
    }
  },
  "required": [
    "schema_version",
    "paper",
    "version",
    "recorded_utc",
    "claims",
    "gates",
    "review_contexts",
    "blockers",
    "submission",
    "input_pdf",
    "input_sources",
    "linked_records"
  ],
  "additionalProperties": false
}
