{
  "schema_version": "1.0",
  "paper": "REPLACE",
  "version": "REPLACE",
  "recorded_utc": "REPLACE",
  "claims": [],
  "gates": [
    {
      "id": "S00",
      "status": "pending",
      "owner": "assign owner",
      "notes": "Evidence not supplied yet"
    },
    {
      "id": "S01",
      "status": "pending",
      "owner": "assign owner",
      "notes": "Evidence not supplied yet"
    },
    {
      "id": "S02",
      "status": "pending",
      "owner": "assign owner",
      "notes": "Evidence not supplied yet"
    },
    {
      "id": "S03",
      "status": "pending",
      "owner": "assign owner",
      "notes": "Evidence not supplied yet"
    },
    {
      "id": "S04",
      "status": "pending",
      "owner": "assign owner",
      "notes": "Evidence not supplied yet"
    },
    {
      "id": "S05",
      "status": "pending",
      "owner": "assign owner",
      "notes": "Evidence not supplied yet"
    },
    {
      "id": "S06",
      "status": "pending",
      "owner": "assign owner",
      "notes": "Evidence not supplied yet"
    },
    {
      "id": "S07",
      "status": "pending",
      "owner": "assign owner",
      "notes": "Evidence not supplied yet"
    },
    {
      "id": "S08",
      "status": "pending",
      "owner": "assign owner",
      "notes": "Evidence not supplied yet"
    },
    {
      "id": "S09",
      "status": "pending",
      "owner": "assign owner",
      "notes": "Evidence not supplied yet"
    },
    {
      "id": "S10",
      "status": "pending",
      "owner": "assign owner",
      "notes": "Evidence not supplied yet"
    },
    {
      "id": "S11",
      "status": "pending",
      "owner": "assign owner",
      "notes": "Evidence not supplied yet"
    },
    {
      "id": "S12",
      "status": "pending",
      "owner": "assign owner",
      "notes": "Evidence not supplied yet"
    },
    {
      "id": "S13",
      "status": "pending",
      "owner": "assign owner",
      "notes": "Evidence not supplied yet"
    },
    {
      "id": "S14",
      "status": "pending",
      "owner": "assign owner",
      "notes": "Evidence not supplied yet"
    },
    {
      "id": "S15",
      "status": "pending",
      "owner": "assign owner",
      "notes": "Evidence not supplied yet"
    }
  ],
  "review_contexts": [],
  "blockers": [
    "Complete claim ledger and stage evidence"
  ],
  "submission": {
    "authors_confirmed": false,
    "journal_selected": false,
    "consent_confirmed": false,
    "disclosures_checked": false,
    "automatic_submission": false,
    "publication_authorized": false,
    "notes": "Preparation is not submission authority"
  },
  "input_pdf": {
    "path": "REPLACE_WITH_RELATIVE_FILE",
    "sha256": "0000000000000000000000000000000000000000000000000000000000000000"
  },
  "input_sources": [
    {
      "path": "REPLACE_WITH_RELATIVE_FILE",
      "sha256": "0000000000000000000000000000000000000000000000000000000000000000"
    }
  ],
  "pdf_sha256": "0000000000000000000000000000000000000000000000000000000000000000",
  "linked_records": {
    "proof_obligations": {
      "path": "REPLACE_WITH_RELATIVE_FILE",
      "sha256": "0000000000000000000000000000000000000000000000000000000000000000"
    },
    "review_response": {
      "path": "REPLACE_WITH_RELATIVE_FILE",
      "sha256": "0000000000000000000000000000000000000000000000000000000000000000"
    },
    "version_registry": {
      "path": "REPLACE_WITH_RELATIVE_FILE",
      "sha256": "0000000000000000000000000000000000000000000000000000000000000000"
    },
    "receipts": {
      "path": "REPLACE_WITH_RELATIVE_FILE",
      "sha256": "0000000000000000000000000000000000000000000000000000000000000000"
    },
    "required_inventory": {
      "path": "REPLACE_WITH_RELATIVE_FILE",
      "sha256": "0000000000000000000000000000000000000000000000000000000000000000"
    }
  }
}
